question,context,answer
¿A quién debo pedirle una carta de recomendación?,"Pídele la carta a profesores de asignaturas relevantes para tu carrera, o a un consejero escolar o a alguien que supervisó un proyecto o actividad extracurricular importante. Lo más importante es que la persona te conozca y pueda dar ejemplos concretos de tus habilidades.","A profesores de materias clave, a tu consejero escolar o a supervisores de actividades donde hayas destacado, siempre que te conozcan bien."
¿Con cuánto tiempo de antelación debo solicitar las cartas?,"Es recomendable solicitar las cartas de recomendación al menos uno o dos meses antes de la fecha límite de aplicación. Esto le da al profesor suficiente tiempo para reflexionar y escribir una carta de alta calidad, especialmente si está ocupado con otros estudiantes.",Solicítalas al menos uno o dos meses antes del plazo de aplicación para que el profesor tenga tiempo suficiente para escribir una buena carta.
¿Qué debo proporcionarle a mi recomendador?,"Para ayudar a tu recomendador, proporciónale tu currículum, un borrador de tu ensayo personal, una lista de las universidades a las que aplicas con sus fechas límite, y un recordatorio de la clase que tomaste con él y los proyectos en los que destacaste.","Debes darle tu currículum, ensayo, la lista de universidades y recordatorios de tus logros en su clase para que la carta sea específica y detallada."
¿Cómo se envían las cartas a las universidades?,"Generalmente, las cartas de recomendación se envían directamente por el profesor a través de la plataforma de aplicación (como CommonApp), o por correo electrónico seguro. No se le pide al estudiante que las maneje para asegurar la confidencialidad y la honestidad de la recomendación.",El profesor la envía directamente a la universidad a través de la plataforma de aplicación. Tú no la manejas para mantener la confidencialidad.
How can I get strong letters of recommendation for U.S. universities?,"To get a strong letter, you should ask a teacher who knows you well and can speak positively about your achievements and potential. It's best to ask them several weeks in advance and provide them with all the necessary documents to help them write a detailed and specific letter.","Ask a teacher who knows you well, give them plenty of time, and provide them with all your documents and achievements to ensure the letter is detailed and specific."
Who should I ask for a letter of recommendation?,"Ask teachers from subjects relevant to your major, your school counselor, or someone who supervised a significant extracurricular project. The most important thing is that the person knows you well and can provide concrete examples of your skills and character.","You should ask teachers of key subjects, your school counselor, or supervisors of activities where you excelled, as long as they know you personally."
How far in advance should I request the letters?,"It's best to request letters of recommendation at least one to two months before the application deadline. This gives the recommender plenty of time to reflect and write a high-quality letter, especially since they may have many other students asking for letters as well.",Request them at least one to two months before the deadline to give your recommender sufficient time to write a strong letter.
What should I provide to my recommender?,"To help your recommender, you should provide them with your resume, a draft of your personal essay, a list of the universities you are applying to with their deadlines, and a reminder of your work in their class and any specific projects where you stood out.","You should give them your resume, essay, a list of your schools and deadlines, and reminders of your achievements in their class to make the letter specific."
How are the letters sent to universities?,"Letters of recommendation are usually sent directly by the teacher through the application platform (like CommonApp), or via secure email. Students are not typically allowed to handle the letters to ensure the confidentiality and honesty of the recommendation.",The teacher sends the letter directly to the university through the application portal. You do not handle it to maintain confidentiality.
¿Cómo escribir un ensayo personal impactante?,"Un ensayo personal impactante cuenta una historia única sobre ti. Para lograrlo, elige un tema que te apasione, usa una voz auténtica y sé vulnerable. No te limites a repetir lo que está en tu currículum, usa el ensayo para mostrar quién eres, cómo piensas y cómo te enfrentas a los desafíos.","Cuenta una historia personal y única, sé auténtico y muestra tu personalidad. No solo repitas tus logros, sino explica cómo te formaron."
¿Qué temas debo elegir para mi ensayo personal?,"Elige un tema que te permita reflexionar sobre tu crecimiento personal, tus valores o un desafío que superaste. Evita temas comunes o que puedan sonar genéricos. Tu historia puede ser sobre un momento pequeño pero significativo en tu vida que te enseñó algo importante.","Elige un tema que te permita reflexionar sobre un crecimiento personal o un desafío, y que no sea un tema genérico."
¿Qué debo evitar en mi ensayo personal?,"Evita escribir sobre temas controvertidos, historias que suenen como una lista de logros o temas que no te permitan reflexionar de manera profunda. También, evita errores gramaticales o de ortografía y no uses un lenguaje demasiado complicado. Sé claro y conciso.","Evita temas controvertidos o genéricos, no hagas una lista de tus logros y asegúrate de que no haya errores de gramática."
¿Qué importancia tiene el ensayo personal?,"El ensayo personal es una de las partes más importantes de tu solicitud, ya que es tu oportunidad de diferenciarte de otros candidatos. Le da a los comités de admisión una idea de tu personalidad, tus valores y tu potencial para contribuir a la comunidad universitaria. Es la pieza que les da una visión completa de quién eres.","Es crucial porque es tu oportunidad de mostrar tu personalidad y tus valores, diferenciándote de otros candidatos que tienen calificaciones similares."
¿Cómo puedo revisar mi ensayo personal?,"Después de escribir varios borradores, pide a personas de confianza (como un profesor de inglés, un consejero o un familiar) que lo lean. Dales instrucciones específicas para que revisen la gramática, la estructura, el flujo de ideas y, lo más importante, que te digan si el ensayo realmente suena a 'ti'.","Pídele a varias personas de confianza, como profesores o consejeros, que lo lean para que te den retroalimentación sobre la gramática, el flujo y si transmite tu voz de forma auténtica."
How do I write an effective personal statement for my application?,"An effective personal statement tells a unique story about you. To achieve this, choose a topic you're passionate about, use an authentic voice, and be vulnerable. Don't just repeat what's on your resume; use the essay to show who you are, how you think, and how you approach challenges.","Tell a unique and personal story, be authentic, and show your personality. Don't just list your achievements; explain how they shaped you."
What topics should I choose for my personal statement?,"Choose a topic that allows you to reflect on your personal growth, values, or a challenge you overcame. Avoid common topics or those that sound generic. Your story can be about a small, but significant, moment in your life that taught you an important lesson.","Choose a topic that allows you to reflect on a personal challenge or growth, and avoid generic or overused subjects."
What should I avoid in my personal statement?,"Avoid writing about controversial topics, stories that sound like a list of achievements, or subjects that don't allow for deep reflection. Also, avoid grammatical or spelling errors and don't use overly complicated language. Be clear and concise.","Avoid controversial or generic topics, don't just list achievements, and make sure to proofread for any grammatical errors."
How important is the personal statement?,"The personal statement is one of the most important parts of your application because it's your chance to stand out from other applicants. It gives admissions committees insight into your personality, values, and potential to contribute to the university community. It’s the piece that provides a complete picture of who you are.","It is crucial because it's your chance to show your personality and values, differentiating you from other candidates with similar grades and test scores."
How can I revise my personal statement?,"After writing several drafts, ask trusted individuals (such as an English teacher, a counselor, or a family member) to read it. Give them specific instructions to check for grammar, structure, flow, and, most importantly, to tell you if the essay truly 'sounds like you.'","Ask several trusted people, like teachers or counselors, to read it for feedback on grammar, flow, and to ensure it authentically conveys your voice."
¿Qué es la visa F-1 y cómo se obtiene?,"La visa F-1 es un tipo de visa de no inmigrante que permite a los estudiantes internacionales estudiar en una institución académica aprobada en Estados Unidos. Para obtenerla, primero debes ser aceptado por una universidad y recibir tu Formulario I-20.","La visa F-1 es para estudiar en EE.UU. Para obtenerla, primero necesitas ser admitido en una universidad y recibir el Formulario I-20."
¿Cuál es el proceso para solicitar la visa F-1?,"El proceso implica varios pasos: ser aceptado en una universidad y recibir el I-20, pagar la tarifa SEVIS, completar el formulario de solicitud DS-160 en línea y, finalmente, asistir a una entrevista en la embajada o consulado de EE.UU. en tu país de origen.","Debes ser aceptado por una universidad, recibir el I-20, pagar la tarifa SEVIS, completar el DS-160 y asistir a una entrevista en la embajada."
¿Qué documentos son necesarios para la entrevista de la visa F-1?,"Para la entrevista, necesitas llevar tu pasaporte vigente, el formulario I-20 original, el recibo de pago de la tarifa SEVIS, la página de confirmación del DS-160 y pruebas de que tienes fondos suficientes para cubrir tus estudios y gastos de manutención.","Necesitas tu pasaporte, I-20, el recibo SEVIS, la confirmación del DS-160 y pruebas de que tienes fondos para estudiar."
¿Puedo trabajar con una visa F-1?,"Con una visa F-1, puedes trabajar en el campus (on-campus) hasta 20 horas por semana durante el semestre. Para trabajar fuera del campus (off-campus) necesitas una autorización especial a través de programas como CPT o OPT, que están directamente relacionados con tu campo de estudio.","Puedes trabajar en el campus con restricciones. Para trabajar fuera, necesitas autorización específica como CPT u OPT."
¿Qué es la tarifa SEVIS?,La tarifa SEVIS es un cargo obligatorio que los estudiantes internacionales deben pagar para financiar el Sistema de Información para Estudiantes y Visitantes de Intercambio (SEVIS). El sistema rastrea a los estudiantes con visa F-1 durante su estadía en EE.UU. Debes pagar esta tarifa antes de tu entrevista para la visa.,Es una tarifa obligatoria para financiar el sistema que rastrea a los estudiantes con visa F-1. Debes pagarla antes de tu entrevista.
What is the F-1 visa and how do I get it?,"The F-1 visa is a type of nonimmigrant visa that allows international students to study at an approved academic institution in the United States. To get it, you must first be accepted by a university and receive your Form I-20.","The F-1 visa is for studying in the U.S. To get it, you first need to be admitted to a university and receive your Form I-20."
What is the process to apply for the F-1 visa?,"The process involves several steps: getting accepted by a university and receiving the I-20, paying the SEVIS fee, completing the online DS-160 application form, and finally, attending an interview at a U.S. embassy or consulate in your home country.","You must be accepted by a university, get your I-20, pay the SEVIS fee, complete the DS-160, and attend an embassy interview."
What documents are needed for the F-1 visa interview?,"For the interview, you need to bring your valid passport, the original Form I-20, the SEVIS fee payment receipt, the DS-160 confirmation page, and proof of sufficient funds to cover your tuition and living expenses.","You need your passport, I-20, SEVIS receipt, DS-160 confirmation, and proof of funds to support your studies."
Can I work on an F-1 visa?,"With an F-1 visa, you can work on-campus for up to 20 hours per week during the semester. To work off-campus, you need special authorization through programs like CPT or OPT, which must be directly related to your field of study.","You can work on-campus with restrictions. For off-campus work, you need specific authorization like CPT or OPT."
What is the SEVIS fee?,The SEVIS fee is a mandatory charge that international students must pay to fund the Student and Exchange Visitor Information System (SEVIS). This system tracks F-1 visa students during their stay in the U.S. You must pay this fee before your visa interview.,It is a mandatory fee to fund the system that tracks F-1 visa students. You must pay it before your visa interview.
¿Qué es el Formulario I-20 y por qué es importante?,"El Formulario I-20, 'Certificate of Eligibility for Nonimmigrant Student Status', es un documento oficial emitido por una universidad a un estudiante internacional aceptado. Es crucial porque es la prueba de que has sido admitido y es necesario para solicitar la visa F-1.",Es un documento oficial de la universidad que prueba tu admisión y es esencial para poder solicitar la visa F-1.
¿Cómo se obtiene el Formulario I-20?,"Una vez que la universidad te ha admitido, debes enviar los documentos financieros requeridos para demostrar que tienes fondos para cubrir tu primer año de estudios. Después de verificar tus finanzas, la universidad te emitirá y enviará el Formulario I-20.",La universidad te lo envía después de que eres aceptado y presentas prueba de que tienes fondos suficientes para tus estudios.
¿Qué información contiene el I-20?,"El I-20 contiene información importante sobre ti y el programa de estudios. Incluye tu nombre, tu número de SEVIS, el nombre de la universidad, tu fecha de inicio y finalización del programa, y una estimación de los costos de matrícula y de vida.","Contiene tu información personal, tu número de SEVIS, detalles de tu universidad y programa de estudios, y una estimación de los costos."
¿Qué debo hacer si hay un error en mi I-20?,"Si notas algún error en tu I-20, como una falta de ortografía en tu nombre, una fecha incorrecta o una información financiera errónea, debes contactar de inmediato a la Oficina de Estudiantes Internacionales de tu universidad para solicitar un I-20 corregido antes de tu entrevista para la visa.",Debes contactar a la oficina de estudiantes internacionales de tu universidad inmediatamente para que te emitan un formulario corregido.
¿Es necesario presentar el I-20 en la entrada a EE.UU.?,"Sí, es indispensable. Cuando llegues a un puerto de entrada en EE.UU., deberás presentar tu pasaporte, visa F-1 y el I-20 a los oficiales de aduanas. El I-20 confirma tu estatus como estudiante y tu permiso para entrar.","Sí, debes presentarlo junto con tu pasaporte y visa F-1 a los oficiales de aduanas al llegar a EE.UU."
What is the I-20 Form and why is it important?,"The Form I-20, 'Certificate of Eligibility for Nonimmigrant Student Status', is an official document issued by a university to an accepted international student. It is crucial because it serves as proof of your admission and is required to apply for the F-1 visa.",It is an official document from the university that proves your admission and is essential for applying for the F-1 visa.
How do I get the I-20 Form?,"Once you have been admitted to a university, you need to submit required financial documents to prove that you have the funds to cover your first year of studies. After verifying your finances, the university will issue and send the Form I-20 to you.",The university sends it to you after you are accepted and provide proof of sufficient funds for your studies.
What information does the I-20 contain?,"The I-20 contains important information about you and your study program. It includes your name, your SEVIS number, the university's name, your program's start and end dates, and an estimate of tuition and living costs.","It contains your personal information, your SEVIS number, details about your university and program, and an estimate of costs."
What should I do if there's a mistake on my I-20?,"If you notice any mistakes on your I-20, such as a spelling error in your name, an incorrect date, or wrong financial information, you must immediately contact your university's International Student Office to request a corrected I-20 before your visa interview.",You must contact your university's international student office immediately to have a corrected form issued.
Is it necessary to present the I-20 upon entering the U.S.?,"Yes, it is essential. When you arrive at a U.S. port of entry, you must present your passport, F-1 visa, and the I-20 to the customs officers. The I-20 confirms your student status and your permission to enter.","Yes, you must present it along with your passport and F-1 visa to customs officers upon arriving in the U.S."
¿Cómo obtener el formulario I-94 después de entrar a EE.UU.?,"El Formulario I-94, o 'Arrival/Departure Record', es un registro electrónico que se crea automáticamente cuando entras a EE.UU. ya sea por avión o por mar. No se te dará una copia en papel. Debes obtenerlo en línea a través del sitio web de la Oficina de Aduanas y Protección Fronteriza (CBP).","Se crea de forma electrónica cuando entras al país, y debes descargarlo en línea desde el sitio web de la Oficina de Aduanas y Protección Fronteriza (CBP)."
¿Qué información necesito para buscar mi I-94?,"Para buscar y descargar tu I-94 en línea, necesitarás ingresar tu nombre, fecha de nacimiento, número de pasaporte y la fecha de tu entrada a EE.UU. Es importante que la información sea exacta para poder encontrar tu registro.","Necesitas tu nombre, fecha de nacimiento, número de pasaporte y la fecha de tu entrada a EE.UU. para buscarlo en línea."
¿Por qué es importante el I-94 para un estudiante F-1?,"Para un estudiante F-1, el I-94 es muy importante porque valida tu estatus legal en el país y tu periodo de estadía autorizada, que generalmente está marcado como 'D/S' (Duración de Estatus). Demuestra que estás legalmente en el país mientras mantengas tu estatus de estudiante.","Es importante porque demuestra que estás legalmente en el país con un estatus de 'Duración de Estatus' (D/S), que se mantiene mientras estudies."
¿Qué debo hacer si no encuentro mi I-94 en línea?,"Si no puedes encontrar tu I-94 en línea, primero verifica que toda la información que ingresaste sea correcta. Si el problema persiste, debes contactar a la Oficina de Aduanas y Protección Fronteriza (CBP) o ir a una oficina de Deferred Inspection para que te ayuden a corregir el registro.","Primero verifica los datos. Si no funciona, contacta a la Oficina de Aduanas y Protección Fronteriza (CBP) para que te ayuden a corregirlo."
¿Necesito una copia impresa del I-94?,"Aunque el I-94 es un registro electrónico, es altamente recomendable que imprimas una copia para tus archivos personales. Muchas universidades, agencias gubernamentales o empleadores pueden pedir una copia impresa como prueba de tu estatus migratorio. También es útil para renovaciones de visa o para solicitar beneficios.","Sí, es muy recomendable imprimir una copia para tus archivos personales, ya que muchas oficinas y universidades la pedirán como prueba de tu estatus."
How to get the I-94 form after entering the U.S.?,"The Form I-94, or 'Arrival/Departure Record', is an electronic record created automatically when you enter the U.S. by air or sea. You will not receive a paper copy. You must retrieve it online from the Customs and Border Protection (CBP) website.","It is created electronically when you enter the country, and you must download it online from the Customs and Border Protection (CBP) website."
What information do I need to look up my I-94?,"To look up and download your I-94 online, you will need to enter your name, date of birth, passport number, and the date of your entry into the U.S. It is important that the information is accurate in order to find your record.","You need your name, date of birth, passport number, and the date of your entry to the U.S. to search for it online."
Why is the I-94 important for an F-1 student?,"For an F-1 student, the I-94 is very important because it validates your legal status in the country and your authorized period of stay, which is typically marked as 'D/S' (Duration of Status). It proves you are legally in the country as long as you maintain your student status.","It's important because it proves you are legally in the country with 'Duration of Status' (D/S), which lasts as long as you are a student."
What should I do if I can't find my I-94 online?,"If you cannot find your I-94 online, first double-check that all the information you entered is correct. If the problem persists, you should contact Customs and Border Protection (CBP) or visit a Deferred Inspection site for help correcting your record.","First, verify your details. If that doesn't work, contact Customs and Border Protection (CBP) to have them help correct the record."
Do I need a printed copy of the I-94?,"Although the I-94 is an electronic record, it is highly recommended that you print a copy for your personal files. Many universities, government agencies, or employers may ask for a printed copy as proof of your immigration status. It is also useful for visa renewals or for applying for benefits.","Yes, it is highly recommended to print a copy for your personal records, as many offices and universities will ask for it as proof of your status."
¿Qué es el OPT y quién califica para aplicarlo?,"OPT (Optional Practical Training) es una autorización de trabajo temporal para estudiantes con visa F-1 que les permite obtener experiencia laboral en su campo de estudio. Para calificar, debes haber estado inscrito a tiempo completo en una universidad de EE.UU. por al menos un año académico completo y tener un estatus de visa F-1 válido.","El OPT es un permiso de trabajo temporal para estudiantes F-1. Para calificar, debes haber estudiado a tiempo completo por al menos un año académico y tener un estatus de visa válido."
¿Cuándo puedo aplicar para el OPT?,Puedes aplicar para el OPT hasta 90 días antes de la fecha de finalización de tu programa de estudios y hasta 60 días después de esa fecha. Es crucial que no empieces a trabajar hasta que recibas tu EAD (Employment Authorization Document) y la fecha de inicio de empleo haya llegado.,"Puedes aplicar 90 días antes o hasta 60 días después de la graduación, pero no puedes empezar a trabajar hasta que recibas tu EAD."
¿Cuánto tiempo dura el OPT?,"El OPT estándar dura 12 meses. Los estudiantes con un título en un campo STEM (Ciencia, Tecnología, Ingeniería y Matemáticas) pueden solicitar una extensión de 24 meses adicionales, lo que les da un total de 36 meses de OPT.","El OPT estándar dura 12 meses, y los estudiantes de campos STEM pueden solicitar una extensión de 24 meses adicionales."
¿Puedo hacer OPT antes de graduarme?,"Sí, existe el 'pre-completion OPT', que te permite trabajar a tiempo parcial mientras estudias. Sin embargo, cualquier tiempo que uses para el pre-completion OPT se restará de los 12 meses de tu post-completion OPT. La mayoría de los estudiantes prefieren reservar los 12 meses para después de la graduación.","Sí, existe el 'pre-completion OPT', pero el tiempo que uses se resta de tus 12 meses de OPT después de graduarte."
¿Qué es el EAD (Employment Authorization Document)?,El EAD es una tarjeta física emitida por los Servicios de Ciudadanía e Inmigración de EE.UU. (USCIS) que te autoriza oficialmente a trabajar en el país. No puedes empezar a trabajar bajo OPT hasta que hayas recibido esta tarjeta y la fecha de inicio en ella haya llegado.,Es una tarjeta de autorización de empleo emitida por el gobierno de EE.UU. que necesitas tener físicamente antes de poder empezar a trabajar con OPT.
What is OPT and who is eligible to apply?,"OPT (Optional Practical Training) is a temporary work authorization for F-1 visa students that allows them to gain work experience in their field of study. To be eligible, you must have been enrolled full-time at a U.S. university for at least one full academic year and have a valid F-1 visa status.","OPT is a temporary work permit for F-1 students. To be eligible, you must have studied full-time for at least one academic year and have a valid F-1 visa status."
When can I apply for OPT?,You can apply for OPT as early as 90 days before your program end date and as late as 60 days after that date. It is crucial that you do not begin working until you have received your EAD (Employment Authorization Document) and the employment start date on it has arrived.,"You can apply 90 days before or up to 60 days after graduation, but you can't start working until your EAD is approved and the start date has passed."
How long does OPT last?,"Standard OPT lasts for 12 months. Students with a degree in a STEM-designated field (Science, Technology, Engineering, and Math) can apply for a 24-month extension, giving them a total of 36 months of OPT.","Standard OPT lasts for 12 months, with an additional 24-month extension available for students with a STEM degree."
