question,context,answer
Can I reapply immediately after a denial?,"Yes, you can reapply immediately, but it is generally not recommended without first understanding why you were denied. You should take time to review your application, gather new documents that address the cause of the denial, and better prepare for the interview, showing that your situation has changed.","You can, but it is better to first analyze the reason for the denial, gather more evidence, and prepare better before a new interview."
How can I demonstrate ties to my home country?,"You can demonstrate ties to your home country with documents that show your financial situation, property, family, or professional responsibilities. Examples include property deeds, employment letters, family business records, or even a letter from your family explaining why you have strong ties to return.","Demonstrate your financial, family, and professional ties with documents like property deeds, employment letters, or family business records."
What additional documents can I present in the next interview?,"For your next interview, consider bringing documents that you did not present before or that strengthen your arguments. This can include a detailed career plan after your studies, clearer bank statements, or letters from your family that demonstrate your responsibilities. The key is to present evidence that directly addresses the reason for the denial.","Bring documents that strengthen your career plan, clearer bank statements, or proof of your family and professional responsibilities to address the reason for the denial."
¿Qué es el sistema SEVIS y cómo me afecta como estudiante?,"SEVIS (Student and Exchange Visitor Information System) es un sistema de información basado en Internet que el gobierno de EE.UU. utiliza para rastrear y monitorear a los estudiantes y visitantes de intercambio durante su estadía en el país. Como estudiante, te afecta directamente porque tu escuela debe mantener tu información actualizada en el sistema, y tu estatus de visa depende de que esto se haga correctamente.",SEVIS es un sistema del gobierno que rastrea a los estudiantes internacionales. Tu universidad debe mantener tu información actualizada en él para que tu estatus de visa siga siendo válido.
¿Qué es el número SEVIS?,"El número SEVIS es un identificador único que se te asigna cuando tu escuela emite tu Formulario I-20. Este número, que comienza con la letra 'N', te acompaña durante toda tu estancia en EE.UU. como estudiante. Lo necesitarás para pagar la tarifa SEVIS y para tu entrevista de visa.","Es un número de identificación único, que empieza con 'N', que se te asigna en tu I-20 y que te acompaña durante todo tu tiempo como estudiante en EE.UU."
¿Cómo se mantiene mi estatus de SEVIS?,"Para mantener tu estatus, debes cumplir con las reglas de tu visa F-1, como estar inscrito a tiempo completo, notificar a tu universidad cualquier cambio en tu información personal o de contacto dentro de los 10 días posteriores al cambio, y no trabajar sin autorización. Tu universidad es responsable de reportar cualquier incumplimiento a SEVIS.","Mantienes tu estatus estando inscrito a tiempo completo, informando a tu universidad de cualquier cambio de dirección y evitando trabajar sin la autorización adecuada."
¿Qué pasa si mi estatus de SEVIS se cancela?,"Si tu estatus de SEVIS se cancela (por ejemplo, por no inscribirte a tiempo completo, por no notificar un cambio de dirección o por exceder el tiempo de trabajo permitido), podrías perder tu estatus de visa F-1. En ese caso, se te consideraría 'fuera de estatus' y podrías enfrentar consecuencias como la deportación o la prohibición de regresar al país.","Si tu estatus se cancela por incumplir las reglas de tu visa, pierdes tu estatus legal y podrías enfrentar la deportación o la prohibición de volver a entrar a EE.UU."
¿Qué es la tarifa I-901 SEVIS Fee?,"La tarifa I-901 es un pago obligatorio que se debe hacer antes de la entrevista para la visa F-1. El pago es por única vez y se utiliza para financiar el sistema SEVIS. Sin el pago de esta tarifa, no se puede continuar con el proceso de solicitud de la visa.",Es una tarifa obligatoria que debes pagar una vez para financiar el sistema SEVIS. Es un requisito para poder asistir a tu entrevista de visa.
What is the SEVIS system and how does it affect me as a student?,"SEVIS (Student and Exchange Visitor Information System) is an internet-based information system that the U.S. government uses to track and monitor international students and exchange visitors during their stay in the country. As a student, it affects you directly because your school must keep your information updated in the system, and your visa status depends on this being done correctly.",SEVIS is a government system that tracks international students. Your university must keep your information updated in it for your visa status to remain valid.
What is the SEVIS number?,"The SEVIS number is a unique identifier assigned to you when your school issues your Form I-20. This number, which starts with the letter 'N', stays with you throughout your time in the U.S. as a student. You will need it to pay the SEVIS fee and for your visa interview.","It is a unique identification number, starting with 'N', that is assigned on your I-20 and stays with you throughout your time as a student in the U.S."
How do I maintain my SEVIS status?,"To maintain your status, you must comply with your F-1 visa rules, such as being enrolled full-time, notifying your university of any changes to your personal or contact information within 10 days, and not working without authorization. Your university is responsible for reporting any non-compliance to SEVIS.","You maintain your status by being enrolled full-time, reporting any changes to your address to your university, and not working without proper authorization."
What happens if my SEVIS status is terminated?,"If your SEVIS status is terminated (e.g., for not enrolling full-time, not reporting an address change, or working unauthorized hours), you could lose your F-1 visa status. In that case, you would be considered 'out of status' and could face consequences like deportation or being banned from re-entering the country.","If your status is terminated for non-compliance with visa rules, you lose your legal status and could face deportation or a ban on re-entry to the U.S."
What is the I-901 SEVIS Fee?,"The I-901 fee is a mandatory payment that must be made before your F-1 visa interview. It is a one-time payment used to fund the SEVIS system. Without paying this fee, you cannot proceed with your visa application process.",It is a mandatory one-time fee you must pay to fund the SEVIS system. It's a requirement to attend your visa interview.
¿Puedo quedarme en EE.UU. después de graduarme como estudiante internacional?,"Sí, puedes quedarte en EE.UU. después de graduarte, pero por un tiempo limitado y para un propósito específico. La opción más común es el OPT (Optional Practical Training), que te permite trabajar en tu campo de estudio por 12 meses. Los estudiantes de campos STEM pueden solicitar una extensión de 24 meses del OPT.","Sí, puedes quedarte por un tiempo limitado usando programas como el OPT (Optional Practical Training), que te permite trabajar en tu área de estudio por 12 meses."
¿Cómo funciona el OPT después de graduarme?,"El OPT post-graduación te permite trabajar hasta por 12 meses en un puesto que esté directamente relacionado con tu carrera. Debes aplicar por el OPT antes de que se cumplan 60 días desde tu graduación. Una vez aprobado, el gobierno te enviará una tarjeta de autorización de empleo (EAD) con la que puedes empezar a trabajar.",Te permite trabajar por 12 meses en tu campo de estudio. Debes aplicar poco después de graduarte y no puedes empezar a trabajar hasta que recibas tu EAD.
¿Qué opciones tengo después de que termine mi OPT?,"Una vez que tu OPT (o STEM OPT) termine, tus opciones son limitadas. Puedes volver a tu país de origen, inscribirte en un nuevo programa de estudios para mantener tu estatus de visa, o buscar una visa de trabajo H-1B, que es patrocinada por un empleador.","Puedes volver a tu país, inscribirte en otro programa de estudios o buscar una visa de trabajo (H-1B) patrocinada por un empleador."
¿Qué es la visa H-1B?,"La visa H-1B es una visa de no inmigrante que permite a los empleadores de EE.UU. contratar temporalmente a trabajadores extranjeros en ocupaciones especializadas. La solicitud de esta visa es compleja, con un proceso de lotería, y debe ser patrocinada por un empleador, no puedes aplicar por ti mismo.","Es una visa de trabajo para profesionales con ocupaciones especializadas, que debe ser patrocinada por un empleador y se otorga mediante un proceso de lotería."
¿Cuál es la 'grace period' después de graduarme?,"Después de completar tu programa de estudios, tienes un periodo de gracia (grace period) de 60 días. Durante este tiempo, puedes permanecer en EE.UU. legalmente, pero no puedes trabajar. Este tiempo se utiliza para prepararte para el OPT, transferirte a otra escuela o hacer los arreglos para regresar a tu país.","Es un periodo de gracia de 60 días después de graduarte en el que puedes permanecer legalmente en el país, pero no puedes trabajar."
Can I stay in the U.S. after graduation as an international student?,"Yes, you can stay in the U.S. after you graduate, but for a limited time and for a specific purpose. The most common option is OPT (Optional Practical Training), which allows you to work in your field of study for 12 months. Students in STEM fields can apply for a 24-month extension of OPT.","Yes, you can stay for a limited time using programs like OPT (Optional Practical Training), which allows you to work in your field of study for 12 months."
How does OPT work after graduation?,"Post-completion OPT allows you to work for up to 12 months in a position that is directly related to your major. You must apply for OPT within 60 days of your graduation. Once approved, the government will send you an Employment Authorization Document (EAD) card, which you must have before you can begin working.",It allows you to work for 12 months in your field of study. You must apply soon after graduation and cannot begin working until you receive your EAD card.
What are my options after my OPT ends?,"Once your OPT (or STEM OPT) ends, your options are limited. You can return to your home country, enroll in a new degree program to maintain your visa status, or seek an employer-sponsored H-1B work visa.","You can return home, enroll in another degree program, or find an employer to sponsor you for an H-1B work visa."
What is the H-1B visa?,"The H-1B visa is a nonimmigrant visa that allows U.S. employers to temporarily hire foreign workers in specialty occupations. The application for this visa is complex, with a lottery-based process, and it must be sponsored by an employer; you cannot apply for it on your own.",It is a work visa for professionals in specialty occupations that must be sponsored by an employer and is granted through a lottery process.
What is the 'grace period' after I graduate?,"After you complete your degree program, you have a 60-day 'grace period'. During this time, you can legally remain in the U.S. but you cannot work. This time is used to prepare for OPT, transfer to another school, or make arrangements to return to your home country.","It is a 60-day period after graduation during which you can legally remain in the country, but you are not allowed to work."
¿Qué debo empacar para mi viaje y los primeros días en EE.UU.?,"Empaca ropa versátil y cómoda, y capas que se adapten a los cambios de clima. No olvides tus documentos de viaje (pasaporte, visa, I-20, etc.) en tu equipaje de mano. Lleva también un adaptador de corriente para tus dispositivos electrónicos y algunos artículos personales que te hagan sentir en casa.","Empaca ropa cómoda y versátil, tus documentos importantes en el equipaje de mano, un adaptador de corriente y artículos personales para sentirte cómodo."
¿Es mejor empacar mucha ropa o comprarla en EE.UU.?,"Es mejor empacar lo esencial para los primeros días y luego comprar ropa en EE.UU. El tamaño, el estilo y la disponibilidad de ropa varían, y probablemente encontrarás más opciones y precios accesibles una vez que llegues. No te excedas con el equipaje.","Empaca lo esencial y compra la mayoría de tu ropa una vez que llegues a EE.UU., ya que tendrás más opciones y precios accesibles."
¿Qué documentos debo llevar en mi equipaje de mano?,"Es crucial que lleves todos tus documentos de inmigración y admisión a la universidad en tu equipaje de mano, no en el que documentas. Esto incluye tu pasaporte con visa F-1, el Formulario I-20 original, el Formulario I-94 (si aplica) y la carta de admisión. Los oficiales de inmigración los necesitarán al llegar.","Debes llevar tu pasaporte, visa F-1, el I-20 original, el I-94 y tu carta de admisión en tu equipaje de mano."
¿Debo llevar mucho dinero en efectivo?,"No es recomendable llevar grandes cantidades de dinero en efectivo. Lleva una cantidad suficiente para cubrir los gastos de los primeros días, como el transporte desde el aeropuerto y la comida. Una vez que abras tu cuenta bancaria, podrás transferir fondos de manera segura.",Lleva solo el efectivo necesario para los primeros días. Es más seguro abrir una cuenta bancaria y transferir el resto de tus fondos una vez que llegues.
¿Cómo puedo mantenerme en contacto con mi familia?,"Para comunicarte con tu familia, puedes usar aplicaciones como WhatsApp o Skype. Una vez en EE.UU., puedes comprar una tarjeta SIM local o activar un plan de teléfono para tener un número estadounidense. Es importante tener un plan de comunicación establecido antes de salir.","Usa aplicaciones de mensajería como WhatsApp y, una vez en EE.UU., compra una tarjeta SIM local o activa un plan de teléfono para tener un número estadounidense."
¿Cómo puedo manejar el jet lag y la adaptación inicial?,"Para manejar el jet lag, intenta ajustar tu horario de sueño al de tu destino unos días antes de viajar. Una vez que llegues, mantente despierto durante el día, expónte a la luz natural y haz comidas regulares para que tu cuerpo se adapte más rápido. La adaptación cultural toma tiempo, así que sé paciente contigo mismo.","Ajusta tu horario de sueño antes de viajar y, una vez allí, haz actividades diurnas para que tu cuerpo se adapte al nuevo horario y cultura."
¿Cómo me puedo ajustar a la cultura de EE.UU.?,"La adaptación cultural es un proceso gradual. Prepárate para las diferencias en la comunicación y las costumbres sociales. Participa en eventos del campus, únete a clubes y habla con otros estudiantes, tanto locales como internacionales. La Oficina de Estudiantes Internacionales ofrece talleres y eventos que pueden ser de gran ayuda.","Sé paciente y abierto a las diferencias. Participa en la vida del campus, únete a clubes y socializa para entender mejor la cultura y hacer amigos."
¿Qué debo hacer en los primeros días en el campus?,"En tus primeros días, asiste a las orientaciones para estudiantes internacionales. Estas sesiones te proporcionarán información crucial sobre tu estatus de visa, servicios del campus y vida académica. También es un buen momento para conocer a otros estudiantes internacionales y a los consejeros.",Asiste a todas las orientaciones para estudiantes internacionales. Te darán información clave y te permitirán conocer a otros estudiantes y al personal de apoyo.
¿Qué es la 'orientación' y por qué es importante?,"La orientación es un programa obligatorio para estudiantes internacionales. Te familiariza con el campus, las reglas de la universidad y las regulaciones de la visa. Es donde recibirás información vital sobre cómo mantener tu estatus de estudiante y dónde encontrar ayuda, por lo que es de vital importancia asistir.","Es un programa obligatorio que te familiariza con el campus, reglas y regulaciones de tu visa. Es fundamental para mantener tu estatus legal como estudiante."
¿Hay un proceso para registrar mi llegada a EE.UU.?,"Sí, tu universidad te pedirá que te registres en la Oficina de Estudiantes Internacionales una vez que llegues. Este proceso, conocido como 'check-in', es obligatorio y sirve para que la universidad pueda validar tu llegada en el sistema SEVIS y activar tu estatus de estudiante F-1.","Sí, debes registrarte en la Oficina de Estudiantes Internacionales de tu universidad para que ellos puedan validar tu llegada en el sistema SEVIS."
¿Cuáles son algunas diferencias culturales importantes en el ámbito académico y social?,"En el ámbito académico, la participación en clase es muy valorada. Los estudiantes a menudo se sienten cómodos haciendo preguntas y desafiando ideas en un debate. En el ámbito social, la cultura estadounidense tiende a ser más individualista y directa, aunque hay una gran diversidad.","La participación activa en clase es clave, y socialmente la cultura es a menudo más directa e individualista que en otros países."
¿Cómo se interactúa con los profesores en EE.UU.?,"La relación con los profesores en EE.UU. es a menudo más informal de lo que podrías estar acostumbrado. Puedes dirigirte a ellos por su nombre y apellido, o 'Professor [Apellido]'. Ellos esperan que los estudiantes asistan a sus 'horas de oficina' (office hours) para hacer preguntas o discutir temas de clase.",La relación es más informal. Puedes dirigirte a ellos como 'Professor [Apellido]' y esperan que los visites en sus 'horas de oficina' para discutir tus dudas.
¿Cuál es la etiqueta social en el campus?,"En el campus, la etiqueta social valora la puntualidad y el respeto por el espacio personal. La gente es generalmente abierta y amigable, y a menudo inician conversaciones con un simple 'hola'. No te sorprendas si te preguntan '¿cómo estás?', ya que a menudo es solo un saludo y no esperan una respuesta detallada.",La puntualidad y el respeto por el espacio personal son importantes. La gente suele ser abierta y un 'hola' amigable es una forma común de iniciar la interacción.
¿Hay un código de vestimenta en las universidades?,"La mayoría de las universidades no tienen un código de vestimenta estricto. La vestimenta en el campus tiende a ser muy informal y casual, priorizando la comodidad. Puedes ver a los estudiantes usando sudaderas, jeans y ropa deportiva para ir a clase, lo que contrasta con la vestimenta más formal en otros países.","No, no hay un código de vestimenta estricto. La ropa en el campus es generalmente casual y cómoda, como sudaderas y jeans."
¿Se valora el trabajo en equipo?,"Sí, el trabajo en equipo es una parte importante de la cultura académica en EE.UU. Muchos cursos tienen proyectos grupales y se espera que los estudiantes colaboren con sus compañeros. Esto se ve como una habilidad crucial para el éxito profesional, por lo que es un componente valorado en la educación.","Sí, el trabajo en equipo es muy valorado. Muchos cursos incluyen proyectos grupales para fomentar la colaboración, que es una habilidad esencial para el futuro profesional."
¿Cómo es el sistema de salud en EE.UU. para estudiantes internacionales?,"Como estudiante internacional, es obligatorio que tengas un seguro médico. La mayoría de las universidades requieren que compres su plan de seguro. Este seguro te da acceso a los servicios de salud de la universidad (como el centro de salud del campus) y cobertura para visitas a médicos o emergencias fuera de la universidad.","Es obligatorio tener seguro médico. La mayoría de las universidades te exigen comprar su plan, que cubre servicios en el campus y emergencias externas."
¿Es obligatorio el seguro médico que ofrece la universidad?,"Sí, en la mayoría de los casos es obligatorio. Las universidades tienen acuerdos con compañías de seguros que cumplen con los requisitos mínimos de cobertura para estudiantes internacionales. Algunos estudiantes pueden solicitar una exención si tienen un plan de seguro externo que cumple con todos los requisitos de la universidad, pero esto es raro.","Sí, es obligatorio en la mayoría de los casos. La universidad te exige su plan de seguro, aunque en algunos casos puedes solicitar una exención si tienes un plan que cumple con los mismos requisitos."
¿Qué servicios de salud puedo encontrar en el campus?,"Los centros de salud en el campus ofrecen servicios como consultas médicas generales, vacunas, servicios de salud mental y atención de enfermería. Estos servicios suelen ser más accesibles y económicos que ir a un hospital o a un médico fuera del campus, ya que tu seguro los cubre en gran parte.","Puedes encontrar consultas médicas generales, vacunas y servicios de salud mental. Estos servicios suelen ser accesibles y económicos con tu seguro universitario."
¿Qué debo hacer en caso de una emergencia médica?,"En caso de emergencia, debes ir a la sala de emergencias de un hospital o llamar al 911. Es importante llevar contigo tu tarjeta de seguro médico y tu identificación de estudiante en todo momento. Tu universidad también te dará un número de contacto de emergencia para que lo uses en estas situaciones.","En una emergencia, ve a un hospital o llama al 911. Siempre lleva tu tarjeta de seguro médico y tu identificación de estudiante contigo."
¿Cómo funciona el seguro médico para estudiantes?,"El seguro médico funciona con un copago (un monto que pagas por cada visita) y un deducible (un monto que pagas de tu bolsillo antes de que el seguro comience a cubrir el resto). La universidad te dará todos los detalles de cómo funciona el plan que te ofrecen, y qué está cubierto y qué no.",Funciona con copagos y deducibles. Tu universidad te dará la información completa sobre los costos y la cobertura de su plan de seguro.
¿Qué es el 'grace period' y cómo afecta mi visa?,"El 'grace period' es un período de gracia de 60 días que tienes después de graduarte o de terminar tu programa de estudios. Durante este tiempo, puedes permanecer en EE.UU. legalmente, pero no puedes trabajar. Este tiempo se utiliza para prepararte para el OPT, transferirte a otra escuela o hacer los arreglos para regresar a tu país.","Es un período de 60 días después de tu graduación en el que puedes quedarte en EE.UU. legalmente, pero no puedes trabajar. Lo usas para hacer trámites o prepararte para salir del país."
¿Qué puedo hacer durante el 'grace period'?,"Durante el 'grace period', puedes viajar dentro de EE.UU. y hacer los preparativos para tu partida. También es el tiempo en el que debes aplicar para un OPT si deseas trabajar. Sin embargo, no puedes trabajar o ganar ingresos, y una vez que salgas de EE.UU. durante este período, no puedes volver a entrar con esa visa F-1.","Puedes viajar dentro de EE.UU. y preparar tu salida, o aplicar para el OPT. No puedes trabajar, y si sales del país, no puedes volver a entrar con la misma visa."
¿El 'grace period' se aplica a todos los estudiantes F-1?,"Sí, el 'grace period' de 60 días se aplica a todos los estudiantes F-1 que completen exitosamente su programa de estudios. Si un estudiante retira su matrícula o se le termina su estatus por otra razón, el período de gracia es de 15 días, no de 60.","Sí, se aplica a todos los estudiantes F-1 que completan su programa de estudios. Si no lo completas, el periodo de gracia es solo de 15 días."
¿Qué pasa si me quedo más tiempo del 'grace period'?,"Si te quedas en EE.UU. después de que termine tu 'grace period' sin haber cambiado tu estatus, serías considerado 'fuera de estatus'. Esto puede tener consecuencias graves, como la prohibición de regresar al país en el futuro y la deportación. Es vital que cumplas con los plazos.","Si te quedas más tiempo, estarás 'fuera de estatus', lo que puede llevar a la deportación o a la prohibición de volver a EE.UU. en el futuro."
¿Cómo puedo usar el 'grace period' para extender mi estadía?,"Puedes usar el 'grace period' para extender tu estadía si aplicas para un OPT, te transfieres a otra escuela, o si un empleador te patrocina para una visa de trabajo. Sin embargo, debes tener en cuenta que, si no haces ninguno de estos trámites y no sales del país en 60 días, tu estatus se considera ilegal.","Puedes extender tu estadía si aplicas para el OPT o te transfieres a otra universidad. Sin embargo, si no haces nada, tu estatus se vuelve ilegal después de 60 días."
¿Cómo transferir mi visa F-1 a otra universidad?,"Para transferir tu visa F-1 a otra universidad, debes estar en buen estatus y ser aceptado en la nueva institución. La transferencia no es de la visa en sí, sino de tu registro de SEVIS. Ambas universidades (la actual y la nueva) deben colaborar para que tu registro de SEVIS se transfiera de una a otra.",Debes ser aceptado en la nueva universidad y estar en buen estatus. Tu universidad actual y la nueva colaborarán para transferir tu registro de SEVIS.
¿Qué pasos debo seguir para transferirme?,"Primero, debes informar a la Oficina de Estudiantes Internacionales de tu universidad actual de tu intención de transferirte. Luego, la nueva universidad te pedirá que completes una forma de transferencia. Una vez que tu expediente de SEVIS sea liberado por tu universidad actual, la nueva escuela te emitirá un nuevo Formulario I-20.","Informa a tu universidad actual, completa los formularios de transferencia de la nueva escuela y espera a que ellos te emitan un nuevo I-20."
