question,context,answer
What is the EB-2 NIW (National Interest Waiver)?,The EB-2 NIW is an employment-based green card for people with an advanced degree or exceptional ability. It allows you to self-petition for a green card without a job offer if you can prove your work is of 'national interest' to the U.S. This is a very complex process.,It's a green card option for people with advanced degrees or exceptional ability whose work is considered to be in the national interest of the U.S.
Can I return to school to extend my stay in the U.S.?,"Yes, one way to extend your stay is to enroll in a new academic program. This allows you to maintain your F-1 status while you pursue a higher degree, which can also improve your chances of getting a job and a work visa in the future.","Yes, you can extend your F-1 status by enrolling in a new degree program, like a master's or a second bachelor's degree."
¿Qué es el Curricular Practical Training (CPT)?,"El CPT es una autorización temporal para que los estudiantes con visa F-1 obtengan experiencia laboral directamente relacionada con su área de estudio principal. Debe ser una parte integral de su plan de estudios, como una pasantía, una cooperativa de estudios o un practicum.","Es una autorización temporal para que estudiantes con visa F-1 trabajen en un puesto directamente relacionado con su carrera, como parte de su plan de estudios."
¿Cuáles son los requisitos de elegibilidad para el CPT?,"Para ser elegible para CPT, debes tener una visa F-1 válida y haber completado al menos un año académico completo (dos semestres) de estudio a tiempo completo en los EE.UU. Tu trabajo debe estar directamente relacionado con tu especialidad y tu universidad debe autorizarlo a través de un DSO (Designated School Official).","Debes tener una visa F-1 válida, haber completado un año académico y tener una oferta de trabajo directamente relacionada con tu especialidad, que sea aprobada por tu universidad."
¿Cómo se diferencia el CPT del OPT?,"El CPT es una formación práctica que se realiza antes de completar tu programa de estudios, mientras que el OPT (Optional Practical Training) se puede realizar antes o después de la graduación. El CPT debe ser una parte requerida o integral del plan de estudios, y si usas 12 meses o más de CPT a tiempo completo, pierdes tu elegibilidad para el OPT.","El CPT se realiza antes de graduarte y debe ser parte de tu currículo, mientras que el OPT puede ser antes o después, y no es un requisito académico."
¿Es posible trabajar a tiempo completo con CPT?,"Sí, puedes trabajar a tiempo completo (más de 20 horas a la semana) con CPT. Sin embargo, si trabajas 12 meses o más a tiempo completo con CPT, pierdes la elegibilidad para el OPT. El CPT a tiempo parcial (20 horas o menos a la semana) no afecta tu elegibilidad para OPT.","Sí, es posible, pero si trabajas a tiempo completo por 12 meses o más, perderás la elegibilidad para el Optional Practical Training (OPT)."
"¿Cuál es mejor, el TOEFL o el IELTS?","Ambos exámenes son aceptados en la mayoría de las universidades de EE. UU. La elección a menudo depende de la preferencia personal y el formato del examen. El IELTS tiene una sección de 'speaking' en persona, mientras que el TOEFL es completamente por computadora.","La elección depende de tu preferencia, ya que ambos son ampliamente aceptados. El IELTS tiene un formato de 'speaking' cara a cara."
¿Necesito tomar el TOEFL o IELTS para una universidad en EE. UU.?,"Sí, casi todas las universidades en los EE. UU. requieren una prueba de dominio del inglés, como el TOEFL o el IELTS, para estudiantes internacionales, a menos que provengas de un país de habla inglesa o hayas completado tu educación en inglés.","Sí, es un requisito común para estudiantes internacionales, a menos que cumplas con una exención específica."
¿Cuál es la puntuación mínima requerida para el TOEFL?,"Las puntuaciones mínimas varían significativamente según la universidad y el programa. Algunas universidades pueden requerir un puntaje de 80, mientras que otras, más competitivas, pueden pedir 100 o más en el TOEFL iBT.",Depende de la universidad y el programa; los requisitos suelen estar entre 80 y 100 puntos en el TOEFL iBT.
¿Puedo usar un examen de inglés alternativo como Duolingo?,"Algunas universidades, especialmente después de la pandemia, han comenzado a aceptar pruebas alternativas como el Duolingo English Test. Sin embargo, no todas las instituciones lo aceptan, por lo que debes verificar los requisitos específicos de cada universidad.","Algunas universidades sí lo aceptan, pero debes verificarlo con cada institución, ya que no es una norma generalizada."
¿Por cuánto tiempo es válido el puntaje del TOEFL o IELTS?,"Los puntajes de ambos exámenes tienen una validez de dos años a partir de la fecha de la prueba. Después de ese período, deberás volver a tomar el examen si aún lo necesitas para tus aplicaciones.",Los resultados de estos exámenes son válidos por un período de dos años.
¿Qué es la visa F-1?,La visa F-1 es un tipo de visa de no inmigrante que permite a los estudiantes internacionales estudiar en los Estados Unidos en una institución académica aprobada. Es el tipo de visa más común para estudiantes internacionales.,"Es la visa de estudiante no inmigrante más común, que permite estudiar en una institución académica en EE. UU."
¿Cómo se solicita la visa F-1?,"Para solicitar una visa F-1, primero debes ser aceptado en una universidad y recibir el formulario I-20. Después, debes completar el formulario DS-160, pagar la tarifa SEVIS y asistir a una entrevista en la embajada o consulado de EE. UU. en tu país.","Necesitas el formulario I-20 de la universidad, completar el DS-160, pagar la tarifa SEVIS y tener una entrevista en el consulado."
¿Necesito una visa F-1 si ya tengo otra visa?,"Sí, si tu propósito principal es estudiar a tiempo completo en una universidad estadounidense, necesitas la visa F-1. Otras visas, como la de turista (B-2), no te permiten inscribirte en un programa de grado a tiempo completo.","Sí, la visa F-1 es obligatoria para estudios a tiempo completo, ya que otras visas no lo permiten."
¿Pueden mis dependientes venir conmigo con mi visa F-1?,"Sí, tu cónyuge e hijos solteros menores de 21 años pueden solicitar una visa F-2 para acompañarte a los Estados Unidos. Sin embargo, no se les permite trabajar con esta visa y tienen restricciones para estudiar.","Sí, tu cónyuge e hijos menores pueden solicitar una visa F-2 para acompañarte, pero no pueden trabajar."
¿Puedo trabajar con una visa F-1?,"Con una visa F-1, solo puedes trabajar en el campus (on-campus) hasta 20 horas a la semana durante el semestre. Para trabajar fuera del campus (off-campus), necesitas autorización específica a través de programas como el CPT o el OPT.","Puedes trabajar en el campus (on-campus) con restricciones; para trabajar fuera del campus, necesitas autorización especial."
¿Cuáles son los documentos clave para aplicar?,"Generalmente, las universidades piden expedientes académicos (transcripts), un ensayo personal (statement of purpose), cartas de recomendación, puntuaciones de exámenes (TOEFL/IELTS, SAT/ACT) y el formulario de aplicación completado.","Expedientes académicos, ensayos, cartas de recomendación, puntajes de exámenes de inglés y el formulario de aplicación."
¿Cuándo debo empezar a aplicar?,"Lo ideal es empezar la preparación al menos un año antes de la fecha límite de aplicación. Esto te da tiempo para investigar universidades, preparar los exámenes, redactar los ensayos y conseguir las cartas de recomendación.",Es recomendable empezar el proceso al menos un año antes de la fecha límite de aplicación para tener tiempo suficiente.
¿Qué es el 'Common App'?,"El Common Application (Common App) es una plataforma de aplicación en línea que te permite postular a múltiples universidades con un solo formulario. Es utilizado por cientos de universidades en EE. UU., simplificando el proceso de aplicación.","Es una plataforma en línea que te permite aplicar a muchas universidades con un solo formulario, simplificando el proceso."
¿Es importante el GPA (promedio) en mi aplicación?,"Sí, tu promedio de calificaciones (GPA) es un factor muy importante en las decisiones de admisión, ya que demuestra tu rendimiento académico. Las universidades revisarán tus calificaciones en conjunto con la dificultad de tus cursos.","Sí, el GPA es un factor crucial que refleja tu rendimiento académico; las universidades lo evalúan junto con tus cursos."
¿Debo aplicar a programas 'Early Action' o 'Early Decision'?,"El 'Early Action' no es vinculante y te da una respuesta más temprana, mientras que el 'Early Decision' es vinculante y te obliga a asistir a esa universidad si eres aceptado. Debes elegir 'Early Decision' solo si estás 100% seguro de que esa es tu primera opción.","El 'Early Action' es una opción temprana no vinculante, mientras que el 'Early Decision' es vinculante si eres aceptado."
¿A quién debo pedir cartas de recomendación?,"Pide cartas a profesores que te conozcan bien y puedan hablar de tu desempeño académico, ética de trabajo y habilidades. Lo ideal es que sean de profesores de las materias relevantes a tu programa de estudio.",Debes pedirlas a profesores que te conozcan bien y puedan dar un testimonio sólido de tu desempeño académico y habilidades.
¿Con cuánto tiempo de antelación debo solicitarlas?,Lo mejor es solicitar las cartas al menos uno o dos meses antes de la fecha límite de aplicación. Esto le da al profesor suficiente tiempo para escribir una carta bien pensada y detallada.,Solicítalas con al menos uno o dos meses de antelación para dar tiempo al profesor de escribir una buena carta.
¿Debo proporcionar yo la carta de recomendación?,"No. El profesor debe escribir y enviar la carta directamente a la universidad. Tú solo debes proporcionarle la información necesaria, como tu currículum, ensayo personal y la lista de universidades a las que aplicas.","No, el profesor debe enviarla directamente. Tú solo le proporcionas la información y documentos necesarios."
¿Cuántas cartas de recomendación necesito?,La mayoría de los programas de posgrado y pregrado requieren de 2 a 3 cartas de recomendación. Siempre revisa los requisitos específicos de cada universidad a la que apliques.,"Generalmente se requieren entre 2 y 3 cartas, pero debes verificar los requisitos exactos de cada universidad."
¿Qué información debo darle a mi recomendador?,"Proporciona tu currículum, una copia de tu ensayo personal, una lista de las universidades a las que aplicas con sus fechas límite, y un recordatorio de la clase que tomaste con él y los proyectos en los que te destacaste.","Dale tu currículum, ensayo, lista de universidades y un recordatorio de tu trabajo en su clase para ayudarle a escribir la carta."
¿Qué es el CPT?,"CPT (Curricular Practical Training) es una autorización de trabajo temporal para estudiantes con visa F-1 que les permite obtener experiencia práctica directamente relacionada con su campo de estudio, como pasantías o prácticas profesionales, antes de graduarse.","Es un permiso de trabajo para pasantías y prácticas directamente relacionadas con tu carrera, antes de la graduación."
¿Qué es el OPT?,"OPT (Optional Practical Training) es una autorización de trabajo temporal para estudiantes con visa F-1 que les permite trabajar en su campo de estudio después de la graduación (OPT post-completion) o, en algunos casos, antes de la graduación (OPT pre-completion).","Es una autorización para trabajar temporalmente en tu campo de estudio, generalmente después de graduarte."
¿Puedo usar CPT y OPT?,"Sí, puedes usar ambos. Puedes realizar pasantías con CPT durante tu programa de estudios. Si usas menos de 12 meses de CPT a tiempo completo, mantienes la elegibilidad para 12 meses completos de OPT después de graduarte.","Sí, puedes usar ambos; el uso de CPT no afecta tu elegibilidad para OPT, a menos que uses más de 12 meses de CPT a tiempo completo."
¿Cuánto dura el OPT?,"El OPT estándar dura 12 meses. Los estudiantes de STEM (Ciencia, Tecnología, Ingeniería y Matemáticas) pueden solicitar una extensión de 24 meses adicionales (STEM OPT Extension), lo que suma un total de 36 meses.","El OPT estándar dura 12 meses, con una extensión de 24 meses disponible para estudiantes de programas STEM."
¿Cuándo debo aplicar para el OPT?,Debes aplicar para el OPT entre 90 días antes y 60 días después de la fecha de finalización de tu programa. Es crucial no empezar a trabajar hasta que recibas tu EAD (Employment Authorization Document) y la fecha de inicio del empleo haya llegado.,"Debes aplicar entre 90 días antes y 60 días después de tu graduación, y solo puedes empezar a trabajar con el EAD aprobado."
¿Es obligatorio vivir en el campus?,"Algunas universidades tienen un requisito de residencia para estudiantes de primer año (freshmen), obligándolos a vivir en el campus. Después del primer año, generalmente puedes elegir vivir dentro o fuera del campus.","Depende de la universidad; muchas requieren que los estudiantes de primer año vivan en el campus, pero luego es opcional."
¿Cuáles son los beneficios de vivir en el campus?,"Vivir en el campus te ofrece conveniencia, acceso a recursos universitarios, oportunidades para socializar y conocer gente, y una mayor integración en la vida estudiantil. También puede incluir planes de comida y servicios básicos.","Mayor conveniencia y acceso a recursos, oportunidades sociales, y una inmersión completa en la vida estudiantil."
¿Cómo es la comida en el campus?,"La mayoría de los campus tienen planes de comida obligatorios para los estudiantes que viven en las residencias. Hay varias opciones, desde comedores con estilo buffet hasta pequeños cafés y restaurantes de comida rápida dentro del campus. La calidad y variedad varían según la universidad.","La mayoría de las universidades ofrecen planes de comida en comedores estilo buffet, con varias opciones de comida disponibles."
¿Existen clubes o actividades para unirse?,"Sí, las universidades estadounidenses son conocidas por su vibrante vida estudiantil. Hay una amplia variedad de clubes, desde deportivos y académicos hasta culturales y de voluntariado, para que los estudiantes se unan y se involucren.","Sí, hay una enorme variedad de clubes, desde académicos hasta culturales y deportivos, para que te involucres."
¿Puedo tener un auto en el campus?,"Sí, muchas universidades permiten que los estudiantes tengan autos, pero puede haber restricciones de estacionamiento y requerir un permiso especial y pago. También puede ser costoso y no siempre necesario, ya que el transporte público o los servicios del campus son una opción.","Sí, pero generalmente necesitas un permiso de estacionamiento especial y hay restricciones. No siempre es la opción más conveniente."
¿Qué son el SAT y el ACT?,"El SAT y el ACT son exámenes estandarizados utilizados por las universidades de EE. UU. para evaluar la preparación de los estudiantes de secundaria para la universidad. El SAT se enfoca en razonamiento verbal y matemático, mientras que el ACT incluye una sección de ciencias.","Son exámenes estandarizados que evalúan la preparación para la universidad. El ACT incluye una sección de ciencias, a diferencia del SAT."
¿Necesito tomar el SAT o el ACT para aplicar?,"Cada vez más universidades adoptan una política 'test-optional', lo que significa que no es obligatorio presentar los puntajes. Sin embargo, en universidades competitivas, un buen puntaje aún puede fortalecer tu aplicación. Debes verificar los requisitos de cada universidad.","No siempre es obligatorio, ya que muchas universidades son 'test-optional', pero un buen puntaje puede ser beneficioso."
"¿Qué examen es más fácil, el SAT o el ACT?","La dificultad de cada examen es subjetiva. El SAT tiende a tener una estructura más basada en razonamiento, mientras que el ACT es más directo y rápido, con un enfoque en contenido aprendido en la escuela. La mejor opción depende de tu estilo de aprendizaje.","La dificultad es subjetiva; el SAT se enfoca más en razonamiento, mientras que el ACT es más directo y se basa en el conocimiento escolar."
¿Cuándo debo tomar el SAT o el ACT?,Se recomienda tomarlo por primera vez en la primavera del penúltimo año de secundaria (junior year) para tener tiempo de volver a tomarlo si es necesario. La mayoría de los estudiantes lo toman dos veces para tratar de mejorar su puntaje.,Se recomienda tomarlo en el penúltimo año de secundaria para poder volver a tomarlo si buscas mejorar tu puntaje.
¿Puedo enviar mi puntaje más alto?,"Sí, muchas universidades permiten el 'Score Choice' (Elección de Puntaje), donde puedes seleccionar qué puntajes enviar. Algunas universidades también 'superscore', tomando tus mejores subpuntuaciones de diferentes exámenes para crear una nueva puntuación más alta.","Sí, muchas universidades permiten enviar solo tus mejores puntajes, y algunas incluso combinan las mejores subpuntuaciones (superscoring)."
¿Qué tipos de ayuda financiera existen para estudiantes internacionales?,"La ayuda financiera para estudiantes internacionales es limitada. Las principales opciones son becas de la universidad (merit-based scholarships), becas externas, y en algunos casos, becas basadas en la necesidad (need-based aid) de la universidad.","Principalmente becas de mérito o necesidad de la universidad, así como becas de organizaciones externas a la universidad."
¿Qué es una beca de mérito (merit-based scholarship)?,"Una beca de mérito es un tipo de ayuda financiera que se otorga basándose en logros académicos, talentos especiales (como deportes o arte) o habilidades de liderazgo. No se basa en la necesidad financiera del estudiante.","Una beca otorgada por logros académicos, talentos especiales o liderazgo, no por necesidad financiera."
¿Cómo puedo encontrar becas externas?,"Puedes buscar becas en bases de datos en línea como Fastweb o InternationalStudent.com. También puedes consultar a tu asesor de consejería en la escuela, embajadas y fundaciones que ofrecen becas para estudiantes internacionales.","Busca en bases de datos en línea, consulta a tu consejero escolar y a embajadas, o en fundaciones privadas."
¿Puedo trabajar para pagar mis estudios?,"Con una visa F-1, el trabajo está restringido. Solo puedes trabajar en el campus (on-campus) por un máximo de 20 horas a la semana durante el semestre. Esto generalmente no es suficiente para cubrir la matrícula completa, por lo que la ayuda financiera es crucial.","El trabajo está muy restringido con una visa F-1 (on-campus, 20 horas/semana), por lo que es difícil cubrir la matrícula solo trabajando."
¿Cuál es la diferencia entre una beca y un préstamo?,"Una beca (scholarship) es una ayuda financiera que no tienes que devolver. Un préstamo (loan), por otro lado, es dinero prestado que debe ser devuelto con intereses. Los préstamos para estudiantes internacionales suelen requerir un 'cosigner' estadounidense.","Las becas no se devuelven, mientras que los préstamos deben ser pagados de vuelta con intereses."
¿Qué es el examen GRE?,"El GRE (Graduate Record Examinations) es un examen estandarizado que se requiere para la admisión a la mayoría de los programas de posgrado y escuelas de negocios en Estados Unidos. Mide habilidades verbales, de razonamiento cuantitativo y de escritura analítica.",Es un examen estandarizado requerido para la admisión a programas de posgrado y escuelas de negocios en EE.UU.
¿Qué es el Duolingo English Test?,"El Duolingo English Test es una prueba de dominio del inglés en línea, adaptativa y a pedido, que muchas universidades han empezado a aceptar como una alternativa más económica y conveniente al TOEFL o IELTS, especialmente para la admisión de estudiantes internacionales.",Es una prueba de inglés en línea que algunas universidades aceptan como alternativa a otros exámenes como el TOEFL o IELTS.
¿Todas las universidades aceptan el Duolingo en lugar del TOEFL?,"No, no todas las universidades aceptan el Duolingo English Test. Su aceptación varía según la institución y el programa. Es fundamental que verifiques los requisitos de cada universidad a la que planeas aplicar para confirmar si lo aceptan.","No, debes verificar la página de admisiones de cada universidad, ya que la aceptación del Duolingo no es universal."
¿Para qué sirve el GRE?,El GRE es una herramienta de evaluación que ayuda a los comités de admisiones de posgrado a medir el potencial de los solicitantes para tener éxito en un programa de estudios avanzados. Proporciona una métrica estandarizada que complementa tu expediente académico y cartas de recomendación.,"Sirve para que las universidades midan tu preparación para un programa de posgrado, evaluando tus habilidades de razonamiento y escritura."
¿Es obligatorio el GRE para posgrados en USA?,"No en todos los casos. Aunque el GRE es un requisito común, muchos programas y universidades han hecho que su presentación sea opcional ('GRE-optional') o lo han eliminado por completo. Debes revisar los requisitos de admisión de cada programa específico.",No siempre; muchos programas de posgrado están eliminando el requisito del GRE o lo han vuelto opcional.
¿Qué es el formulario I-20?,"El formulario I-20, 'Certificate of Eligibility for Nonimmigrant Student Status', es un documento oficial que una universidad emite a un estudiante internacional aceptado. Es necesario para solicitar la visa F-1 y entrar a Estados Unidos.","Es un documento oficial que la universidad te envía después de aceptarte, y que necesitas para solicitar tu visa F-1."
¿Qué es el I-94?,"El formulario I-94, 'Arrival/Departure Record', es un registro que lleva el gobierno de EE.UU. de la fecha de entrada y la duración autorizada de la estadía de un viajero. Para los estudiantes F-1, el I-94 muestra tu 'duración de estatus' (D/S), lo que significa que puedes permanecer en EE.UU. mientras mantengas tu estatus de estudiante.",Es tu registro de entrada a EE.UU. que indica tu estatus migratorio y por cuánto tiempo se te permite quedarte legalmente.
¿Dónde obtengo mi I-20?,La universidad a la que has sido aceptado es la encargada de emitir y enviarte el I-20. Generalmente lo recibirás por correo después de haber aceptado la oferta de admisión y proporcionado los documentos financieros necesarios.,La universidad te lo envía por correo una vez que has sido admitido y has cumplido con sus requisitos.
¿Cómo obtengo mi I-94?,"Cuando entras a EE.UU. con tu visa F-1, el I-94 se crea automáticamente y está disponible en línea. No se te dará una versión física. Debes imprimirlo desde el sitio web del CBP (Customs and Border Protection) para tus registros personales.",Se genera automáticamente cuando entras a EE.UU. y puedes descargarlo en línea desde el sitio web del CBP.
¿Qué debo hacer si mi I-20 tiene un error?,"Si encuentras algún error en tu I-20, como una falta de ortografía en tu nombre o una fecha incorrecta, debes contactar de inmediato a la Oficina de Estudiantes Internacionales de tu universidad para que emitan un I-20 corregido.",Debes contactar inmediatamente a la Oficina de Estudiantes Internacionales de tu universidad para que emitan una versión corregida.
¿Puedo sacar una licencia de conducir en EE.UU. con una visa F-1?,"Sí, como estudiante con visa F-1 puedes solicitar una licencia de conducir en el estado donde resides. Los requisitos varían, pero generalmente necesitarás tu pasaporte, visa F-1, I-94 e I-20.","Sí, puedes solicitar una licencia de conducir, pero los requisitos varían según el estado en el que vivas."
¿Qué documentos necesito para la licencia de conducir?,"Normalmente necesitarás tu pasaporte, visa F-1, formulario I-20, el registro de llegada I-94, una prueba de residencia en el estado (como un contrato de alquiler o una factura de servicios) y, a veces, una carta de tu universidad.","Generalmente necesitas tu pasaporte, visa F-1, I-20, I-94 y una prueba de residencia, pero debes consultar los requisitos del estado."
¿Puedo usar mi licencia de conducir de mi país?,"Depende del estado. Algunos estados permiten que los estudiantes internacionales usen una licencia de conducir extranjera válida por un tiempo limitado, mientras que otros no lo hacen. Es importante revisar la ley de cada estado para evitar problemas.","Algunos estados lo permiten por un tiempo limitado, pero es esencial verificar las leyes de tráfico de tu estado específico."
¿Tengo que tomar un examen para la licencia?,"Sí, para obtener una licencia de conducir en cualquier estado de EE.UU. se requiere aprobar un examen escrito de conocimiento y un examen práctico de manejo. El examen escrito se puede preparar estudiando el manual de conducir del estado.","Sí, se te requerirá pasar un examen escrito sobre las reglas de tráfico y un examen práctico de manejo."
¿Qué es la 'Social Security Administration denial letter' y la necesito?,"Si no eres elegible para un Número de Seguridad Social (SSN), muchos Departamentos de Vehículos Motorizados (DMV) te pedirán una 'denial letter' de la Social Security Administration (SSA) como parte de tu aplicación para la licencia. Esto demuestra que no tienes un SSN.","Es una carta de la SSA que certifica que no eres elegible para un SSN, y muchos DMV la piden como requisito para la licencia."
